"adal_nr","adalvatnsfall","landsvaedi","landsvaedi_id","M","hraMedal","logMedal","expMedal","M10","hraMedal10","logMedal10","expMedal10","N_ar","nafn","V","N","fjarlægð","Meðalfjöldi","fjoldi.flokk","ATH","ath","vatnsfall_id","vatnsfall"
3,"Affall","Suðurland",7,6179.207735822082,1446.3128661061671,6.370688609432191,584.4601551281372,6179.207735822082,1897.2784286331857,6.835138491586746,929.9571330466576,16,"Affall",-20.38276,63.61448,,,,"Affall","ny","1379","Affall Affall Affallið"
69,"Álftá","Vesturland",2,1308,600.896089141744,6.335009762185561,563.9749085859054,787.5811284478763,571.2304457087201,6.300430552010916,544.806427139185,50,"Álftá",-22.2348524160377,64.5836069338224,-495,641,10,,"","485 1922","Álftá Allt svæðið Álftá á Mýrum Veitá"
110,"Baugsstaðaá","Suðurland",7,128.88266424657877,50.99692718909176,3.7243577267076273,41.44460543155841,128.88266424657877,66.38586506982209,4.088511193030164,59.651016712268785,46,"Vatnas. Baugstaðaós",-20.9488566147356,63.819337787867,-722,63,5,,"","559 1752 1951","Baugsstaðaá Hróarholtslækur Hróarsholtslækur Hróarsholtslækur Baugstaðaós Hróarsholtslækur Voli"
140,"Bjargaós","Norðurland vestra",4,4162,2110.8704709297645,7.566409406610516,1932.190102383226,3092.358939802336,1810.5153075558455,7.459205220005369,1735.767955336544,49,"Víðidalsá og Fitjá",-20.5406041846245,65.5018010396744,440,2067,15,"Bjargaós","","101 2179","Hópið Víðidalsá og Fitjá Víðidalsá Laxasvæði Víðidalsá Silungasvæði"
158,"Blanda","Norðurland vestra",4,12166.04492362983,2948.5752343687113,7.809663705710555,2464.3015653773737,12166.04492362983,4022.7261718435584,8.027070828273768,3062.7571793991215,50,"Blanda",-20.2962972802338,65.6602274039844,455,3984,15,,"","61 437 1966","Blanda Allt svæðið Svartá Allt svæðið Blanda Blöndulón Svartá"
208,"Botnsá","Reykjanes",1,484,219.74230017033696,5.238111926011798,188.31421536921337,334.5132566764478,192.36612074948266,5.015020337345182,150.65920074293047,44,"Botnsá",-21.3572318467797,64.3824052327425,-568,249,5,,"","487","Botnsá Botnsá Litli-Botn Botnsá Stóri-Botn"
257,"Brynjudalsá","Reykjanes",1,1194,302.32347000477483,5.482194867913018,240.37371736340134,279.9670018440154,184.81995780218256,5.127794832226488,168.64481758635685,46,"Brynjudalsá",-21.4055168705755,64.3584182826719,-553,347,10,,"","434","Brynjudalsá Brynjudalsá Hvalfirði Brynjudalsá"
277,"Búðardalsá","Vesturland",2,1329,427.878264449129,5.700339918221458,298.969008710632,978.4930203613898,556.113057796516,6.246430881417374,516.1672709290011,40,"Búðardalsá",-22.2277752006661,65.3099529493178,-200,679,10,,"","431","Búðardalsá Búðardalsá á Skarðsströnd Búðardalsá - Allt svæðið"
343,"Deildará","Norðurland eystra",5,782,338.3261526336975,5.711691510152613,302.38211836091676,578,332.815532641748,5.734517292021702,309.3636024323769,48,"Deildará",-15.947506369337,66.4406396092805,850,371,10,,"","580","Deildará Deildará á Sléttu Deildará"
378,"Dunká (Bakká)","Vesturland",2,620,233.0332271270025,5.341588000463723,208.8440916169404,433.2386281060865,263.2061674969117,5.503663189164717,245.5899288607044,47,"Dunká",-21.9402725053009,65.023985383268,-289,234,5,,"","520","Dunká Dunká (Bakká) Öll"
410,"Eldvatn","Suðurland",7,220,46.01238718358648,3.43908926966774,31.15856818930446,115.07901059067922,54.21069719957378,3.8899618985586533,48.90902298395979,49,"Eldvatn í Meðallandi",-17.94967,63.60361,,43,5,,"","528 659 679 1740 1954","Eldvatn Allt svæðið Eldvatn Eldvatn Botnar Eldvatn Meðallandi Skálmarbær Tjörn Steinsmýrarvötn"
411,"Elliðaár","Reykjanes",1,4130,2169.3894494584674,7.6088277809168074,2015.9136197293412,2424.558395404828,1862.3972472923372,7.506151474910048,1819.1988210019244,50,"Elliðaár",-21.83705448,64.13247058,-553,1665,15,,"","560 1948","Elliðaár Allt svæðið Elliðaár Vorveiði Elliðaár Elliðaár Elliðavatn"
515,"Fjarðarhornsá","Vestfirðir",3,468.1495956873315,144.13197963429607,4.061223038787362,58.045259287441034,468.1495956873315,261.1779185371841,5.469586320244071,237.36198060217404,40,"Fjarðarhornsá",-22.5471403081714,65.646037023244,-170,214,5,,"","1800 1921","Fjarðarhornsá Fjarðarhornsá Kollafirði Fjarðarhornsá Ísafjarðardjúpi Fjarðarhornsá Kollafirði"
531,"Flókadalsá","Norðurland vestra",4,728,107.19152580513608,4.08399473996931,59.382213171471804,102.57518796992481,58.23525580105785,3.967432560646143,52.848670750951506,41,"Flókadalsá í Fljótum",-19.1485445837866,66.0383229524396,610,40,5,,"","740","Flókadalsá Flókadalsá Neðri hluti"
537,"Fnjóská","Norðurland eystra",5,2009.5,552.3565920836568,6.118953503940841,454.388929375864,1020.5,443.19730120991824,5.979029795182554,395.05689605844503,49,"Fnjóská",-18.0923626766111,65.8968091637185,670,824,10,,"","761 1103","Bakkaá Fnjóskadal Fnjóská Fnjóská Laxasvæði"
560,"Fossá","Norðurland vestra",4,221.9682710406023,76.2630649709353,4.086326442150765,59.52083635865133,221.9682710406023,155.81009886630235,5.012917536207262,150.34272726118346,46,"Fossá á Skaga",-19.918556,65.944793,520,64,5,,"","919","Fossá í Skefilstaðahreppi Fossá öll veiðisvæði"
608,"Fróðá","Vesturland",2,468,158.45137411240816,4.749425822118502,115.5179376368446,262.71257429498064,175.99090868335506,5.087025277026938,161.90751498039572,43,"Fróðá",-23.6153828027367,64.8912934824049,-350,188,5,,"","430","Fróðá Fróðá Fróðá"
618,"Fögruhlíðará","Austfirðir",6,165,60.83740270897541,3.689752039940704,40.034918665621454,165,52.12358460525821,3.323326662682404,27.75252043855092,17,"Fögruhlíðará",-14.38734,65.72038,,,,"Fögruhlíðará","ny","999 1904","Fögruhlíðará Allt svæðið Fögruhlíðará Fögruhlíðará Héraðsflóa"
716,"Gljúfurá","Norðurland vestra",4,298,108.8296060485979,4.323915265484816,75.48358878074112,176.7208927130949,57.65362117009262,3.7922791415481307,44.35738190862804,35,"Gljúfurá",-20.4695892333984,65.5001521452225,450,168,5,,"","879","Gljúfurá - Húnaþing Öll svæði Gljúfurá Húnaþingi"
835,"Haffjarðará","Vesturland",2,3558.9074665787866,1823.949350596477,7.430760620361544,1687.090320712641,3558.9074665787866,2693.196752982386,7.871114697936398,2620.485009981465,50,"Haffjarðará",-22.41091333,64.80702757,-464,2582,15,,"","939 1279","Haffjarðará Haffjarðará Haffjarðará Hlíðarvatn Mýrum"
851,"Hafralónsá","Norðurland eystra",5,1079.5,516.4715309103262,6.113763832824028,452.0369086591229,568,412.5133483695658,5.978379011490499,394.7998831120441,48,"Hafralónsá og Kverká",-15.3838915888037,66.141665550671,860,726,10,,"","402 425","Hafralónsá Kverká Hafralónsá Laxasvæði"
867,"Hallá","Norðurland vestra",4,349,152.23571208654823,4.863401222667662,129.46378929143668,344.05082011293354,205.62213472022844,5.267167823210627,193.86612106060878,37,"Hallá",-20.2766422281493,65.7846671526647,465,148,5,,"","959","Hallá Allt svæðið Hallá Skagaströnd"
883,"Haukadalsá","Vesturland",2,2833.8767860519474,1415.5977287562728,7.193418248091342,1330.6439115671517,2833.8767860519474,1470.5886437813645,7.195034804727326,1332.796712405951,50,"Haukadalsá",-21.77201311,65.03787707,-278,1271,15,,"","759 2279","Haukadalsá Efri Haukadalsá Laxasvæði Þverá Laxasvæði Haukadalsá Haukadalsvatn"
955,"Héraðsvötn","Norðurland vestra",4,1491.2854251012145,533.6756148649497,6.038096136049335,419.09437618441603,1491.2854251012145,1092.3780743247494,6.97053934299388,1064.7968864366912,50,"Héraðsvötn",-19.4556927601712,65.5908949667528,559,629,10,,"","532 1200 1619 1859 1870 2219","Héraðsvötn Hofsá Vesturdal Húseyjarkvísl Miklavatn Norðurá Skagafirði Sæmundará Húseyjarkvísl Allt svæðið Sæmundará Allt svæðið"
956,"Hítará","Vesturland",2,2623.2295818903467,1043.6635495388339,6.79506841035156,893.4303773971611,2623.2295818903467,1673.4177476941704,7.360501573175029,1572.6251517641927,50,"Hítará",-22.3323857862058,64.6970082068203,-480,1415,15,,"","526","Hítará Hítará Allt svæðið"
990,"Hoffellsá",,,512.5,124.97399819741842,4.291896331975195,73.10496842638089,13.531967553531507,13.531967553531507,2.6050548531570525,13.531967553531507,18,"Hoffellsá",-15.2419,64.27569,,,,"Hoffellsá","ny","","Laxá í Nesjum Laxá í Nesjum "
996,"Hofsá","Austfirðir",6,4742,1792.3168767873328,7.273047480907527,1440.9349906188984,1759,1125.1343839366648,6.979668739332473,1074.5623477908189,50,"Hofsá og Sunnudalsá",-14.8116129445708,65.7178198136908,1005,2517,15,,"","601 623","Hofsá í Vopnafirði Sunnudalsá Hofsá Laxasvæði Hofsá Silungasvæði Sunnudalsá Allt svæðið"
1040,"Hólsá","Hafbeitarár",8,43709.12354962445,15906.873925660206,9.141813395130656,9337.68269641377,43709.12354962445,26457.10873981072,10.144144817693615,25441.69945485568,35,"Rangárnar",-20.5567,63.68826,,18289,20,,"","281 301 302 760 1041 1877 1911","Austurbakki Hólsár Aðalsvæði Austurbakki Hólsár Neðra Svæði Eystri-Rangá Eystri Rangá Ytri Rangá og Hólsá - Vesturbakki Laxasvæði Þverá Fljóshlíð Þverá Fljótshlíð Eystri Rangá Fiská Hólsá Hólsá - Austurbakki Hróarslækur Ytri Rangá Þverá í Fljótshlið"
1064,"Hraunaós","Norðurland vestra",4,1068.9586653645003,330.427479065305,5.613656290285248,274.14476061457407,1068.9586653645003,364.68739532652523,5.743290105045709,312.08953102108507,50,"Fljótaá",-19.0310680051817,66.0482189628868,610,338,10,,"","530 1958","Fljótaá Allt svæðið Fljótaá Gil og Gilslaug Fljótum"
1106,"Hrútafjarðará","Norðurland vestra",4,1769.7340521114106,709.4479559828762,6.463243727398435,641.1373620920424,1769.7340521114106,973.6553931195185,6.838963629114474,933.5211590746686,47,"Hrútafjarðará og Síká",-21.0709396624489,65.1497443440009,390,797,10,,"","960","Hrútafjarðará Allt svæðið Hrútafjarðará og Síká"
1189,"Hvítá","Vesturland",2,23442,13370.993396472593,9.457085509960379,12798.528853222568,21131.107803196905,15480.116982362957,9.61741401286104,15024.14740739199,50,"Hvítá í Borgarfirði",-21.76392488,64.58356948,-520,15108,20,,"","141 142 384 386 388 421 524 781 901 980 1280 1299 1300 1939","Andakílsá Flókadalsá Borgarfirði Gljúfurá Borgarfirði Grímsá Borgarfirði Gufuá Borgarfirði Hvítá Borgarfirði Kjarrá Litla-Þverá Norðurá Borg Reykjadalsá Seleyri Tunguá Lundarreykjadal Þverá  Þverá Borgarfirði eystri Andakílsá Lax Flókadalsá Flókadalsá Gljúfurá Borgarfirði Gljúfurá Grímsá Allt svæðið Gufuá Borgarfirði Gufuá Hvítá Brennan Hvítá Hvítá - Straumar Hvítá Svarthöfði Kjarrá Allt svæðið Litla Þverá Borgarfirði Litla Þverá Norðurá Allt svæðið Reykjadalsá Reykjadalsá Reykjadalsá svæði 1 Þverá Allt svæðið"
1216,"Hölkná","Norðurland eystra",5,384,176.03646193975206,5.015867771136997,150.78692855347538,240.5,151.87866350478504,4.908020592730574,135.3711943115442,49,"Hölkná",-15.5084639708459,66.1961967683568,860,236,5,,"","581","Hölkná Hölkná Allt svæðið"
1221,"Hörðudalsá","Vesturland",2,377.14969857449495,123.13964109039638,4.494540954997798,89.52706260037847,377.14969857449495,205.76667203446658,5.235845612818887,187.88791962080955,37,"Hörðudalsá",-21.7907629705151,65.0234777620693,-280,70,5,,"","492","Hörðudalsá Hörðudalsá Hörðudalsá"
1268,"Ísafjarðará","Vestfirðir",3,188,52.416121322168195,3.60496091231294,36.78024617439406,162.20758268351705,70.48665210665412,4.149420178214123,63.397230543767584,43,"Ísafjarðará",-22.5828943609327,65.7813176916911,154,73,5,,"","424","Ísafjarðará Ísafjarðará Ísafjarðará"
1290,"Jökulsá á Dal","Austfirðir",6,1386,664.7995174942869,6.137819258389708,463.04269256069716,1386,828.3391314897162,6.666161451139386,785.3751102794397,18,"Jökulsá á Dal",-14.26617,65.66302,,,,"Jökulsá á Dal","ny","1019 1040 1860 1861 1874","Jökulsá á Dal Allt svæðið Jökulsá á Dal Jökla I Jökulsá á Dal Jökulsá á Dal II Kaldá Laxá Jökulsárhlíð Vatnasvæði Jöklu"
1384,"Kjarlaksstaðaá","Vesturland",2,1018,430.6298596836852,5.981629938887194,396.0854373578225,458.2494728767245,325.63702942409896,5.733106851931775,308.92757117540924,48,"Flekkudalsá",-22.3732740876093,65.1596946801634,-232,400,10,,"","496","Flekkudalsá Flekkudalsá við Hvammsfjörð Öll áin"
1462,"Krossá","Vesturland",2,687,241.27990529167334,5.316932792011452,203.7579545329564,298.87250080052826,186.6995264583667,5.1627528052003004,174.64455693374367,50,"Krossá á Skarðsströnd",-22.3628878519189,65.2708294017863,-225,343,10,,"","500","Krossá Krossá Krossá"
1485,"Kúðafljót","Suðurland",7,888,236.4116788270094,5.138762341031942,170.50461111692914,801.0415590325555,450.3583941350469,5.955301189975833,385.79309019260114,50,"Kúðafljót",-18.17564,63.45938,,,,"Kúðafljót","ny","494 527 639 801 1079 1100 1741 1907 1908 1909 1945","Geirlandsá Geirlandsá Grenlækur Svæði 5 - Seglbúðir Hörgsá á Síðu Hörgsá Tungufljót Allt svæðið Tungulækur Allt svæðið Geirlandsá Grenlækur Hellisá Holtsá Hörgsá Hörgárdal Hörgsá Síðu Jónskvísl og Sýrlækur Kúðafljót og hliðarár Skaftá Tungufljót Tungulækur"
1560,"Langadalsá","Vestfirðir",3,1470,511.29582283120607,5.989316401356054,399.14166394477223,1213.9159928122192,523.5995318729098,6.068276697680108,431.93568406448793,49,"Langadalsá / Hvannadalsá",-22.347893613717,65.8993382754938,137,900,10,,"","403 433 1915","Hvannadalsá Hvanndalsá Ströndum Langadalsá Langadalsströnd Hvannadalsá Ísafjarðardjúpi Hvannadalsá Langadalsá Allt svæðið"
1568,"Langá","Vesturland",2,6000,3177.9834335068163,7.954007829323795,2846.9622548544844,5651.103319527411,3393.1171675340815,8.070507052156602,3198.7233375145975,50,"Langá",-22.0132260301242,64.5722630590811,-520,3896,15,,"","428 438","Langá Allt svæðið Langá Urriðaá á Mýrum"
1579,"Laugardalsá","Vestfirðir",3,1382,598.0558756670334,6.2665193528318905,526.6411321046207,1036.8256963162623,435.12379076846366,5.971089342811566,391.9323870159579,49,"Laugardalsá í Ísafjarðardjúpi",-22.6445070342208,66.0079913313169,122,684,10,,"","1239 1950","Laugardalsá Allt svæðið  Laugardalsá Laugardalsvatn"
1585,"Laxá","Vesturland",2,707.352849389147,290.22615605671325,5.506866969200562,246.37800671175313,707.352849389147,455.9641136168994,6.05613560658431,426.7232201055363,45,"Laxá á Skógarströnd",-22.12327272,65.02679273,-292,220,5,,"","381","Laxá á Skógarströnd Laxá á Skógarströnd og Blankur Blankur Laxá á Skógarströnd og Blankur Laxá"
1589,"Laxá","Vesturland",2,3940,1981.886543844185,7.543114870489197,1887.7008206107573,2970.7791641560216,1851.4054104520883,7.464659360970658,1745.2609429614936,48,"Laxá í Leirársveit",-21.85966847,64.38800729,-554,1970,15,,"","321 788 789 1761 1967","Eyrarvatn, Þórisst. Geitabergs Laxá í Leirársveit Selós Svínadal Þórisstaðavatn Þverá Svínadal Laxá í Leirársveit Allt svæðið Selós Svínadal Selós Vötnin í Svínadal Hvalfjarðarsveit Vötnin í Svínadal Þverá Svínadal Þverá"
1590,"Laxá","Reykjanes",1,7624,2671.803497977212,7.824105039463036,2500.1475758724155,3530.701408962772,2203.9674898860576,7.630938166033552,2060.9826570528835,50,"Laxá í Kjós",-21.61263,64.3421,,2396,15,,"","1042 1060 1762","Bugða Laxá í Kjós Meðalfellsvatn Laxá Allt svæðið"
1591,"Laxá","Norðurland eystra",5,10404,3348.3750637106946,7.917456924363433,2744.7819744613107,2291.5,1306.7253185534696,7.0930925049449405,1203.624265048134,50,"Laxá í Aðaldal",-17.4190358119556,65.9901686913489,790,2415,15,,"","104 803 839 1099","Kráká Laxá í Aðaldal Mýrarkvísl Reykjadalsá og Eyvindarlækur Laxá Jarlsstaðir, Tjörn og Árbót Laxá Laxasvæði Laxá Staðartorfa Mýrarkvísl Allt svæðið Reykjadalsá Allt svæðið"
1592,"Laxá","Norðurland vestra",4,490,175.20865429987523,4.760505758393708,116.8049860647729,246.49734018340376,129.63538751920146,4.497279038843555,89.77253110756118,32,"Laxá á Skaga",-19.84952,65.89603,,,,"Laxá á Skaga","ny","1772","Laxá á Skaga Laxá Laxá Laxárdal Skefilstaðahreppi"
1593,"Laxá á Refasveit","Norðurland vestra",4,1153.7169811320755,381.80179707737045,5.728691748200788,307.5666304612703,1153.7169811320755,768.0115526402385,6.623213647874554,752.3590332721534,45,"Laxá á Refasveit",-20.2625811861789,65.7254858982825,458,472,10,,"","499","Laxá á Refasveit 1 Laxá í Refasveit"
1599,"Laxá á Ásum","Norðurland vestra",4,3932,1978.5914888310203,7.476811031780083,1766.598158265786,3383.4182389937105,2044.3074441551003,7.575847054330402,1950.5117525462956,50,"Laxá á Ásum",-20.3357643105902,65.614369,450,1387,15,,"","739 1081","Fremri Laxá  Aðalsvæði Laxá á Ásum Aðalsvæði Laxá á Ásum Ósasvæði Laxá á Ásum Laxá á Ásum,"
1600,"Laxá í Dölum","Vesturland",2,4872,2106.1645404542764,7.533158438813763,1868.9993110086039,3791.8849618936415,2412.2897941805263,7.6795525806431,2163.6514956901265,48,"Laxá í Dölum",-21.77232,65.09869,,2241,15,,"","519","Laxá í Dölum Laxá í Dölum Allt svæðið"
1601,"Laxá í Hvammssveit","Vesturland",2,296.37935646004064,116.64814330988955,4.65819781968316,105.44587833092365,296.37935646004064,159.71850158461336,5.012501631399564,150.28021199921318,35,"Laxá í Hvammssveit",-21.7794529784044,65.2062326216077,-265,104,5,,"","385","Laxá í Hvammssveit Laxá í Hvammssveit Laxár í Hvammsveit"
1615,"Leirvogsá","Reykjanes",1,2377.5,971.5143692449608,6.789099989538781,888.1138902362491,1542.32318510888,889.5718462248036,6.669257764400285,787.8106462935855,50,"Leirvogsá",-21.71058002,64.18258,-553,1115,15,,"","521","Leirvogsá Leirvogsá Allt svæðið Leirvogsá Vorveiði Leirvogsá"
1717,"Miðá","Vesturland",2,1397.5567247285985,407.9206522089913,5.733061848634537,308.9136687289289,1397.5567247285985,711.9111958240577,6.508051798264676,670.5188383261782,49,"Miðá og Tunguá",-21.7671220468492,65.024187042564,-281,507,10,,"","423","Miðá Allt svæðið Miðá og Tunguá"
1733,"Miðfjarðará","Norðurland vestra",4,10575.738993710693,3344.078988785558,7.962827152138618,2872.1815792391235,10575.738993710693,5540.54494392779,8.54897385391348,5161.455301643989,50,"Miðfjarðará",-20.9095441784382,65.3458294679127,410,4185,15,,"","1339 1746 1747 1748","Austurá Miðfjarðará Núpsá Vesturá Miðfjarðará Allt svæðið Miðfjarðará Lax- og silungasvæði"
1734,"Miðfjarðará","Austfirðir",6,648.5,302.63901991593855,5.574468849008253,263.60950199699704,462.5,270.2311975880988,5.519377255907142,249.47962684037455,49,"Miðjarðará við Bakkafj.",-15.0974429503912,66.0422430792035,950,409,10,,"","459","Miðfjarðará Allt svæðið Miðfjarðará í Bakkafirði"
1885,"Ormarsá","Norðurland eystra",5,1351.5,443.9678963295145,5.955302608371365,385.7936374001849,1351.5,565.1926920146211,6.155776209356672,471.4326308974015,49,"Ormarsá",-15.904984401712,66.4074995970125,825,648,10,,"","439","Ormarsá Ormarsá Ormarsá"
1898,"Ósá","Vesturland",2,592,164.32176377073327,4.625775655541763,102.08192279140326,18.452683027542964,11.290183609776816,2.281368786865452,9.79007176412552,40,"Setbergsá",-22.5672918265297,65.0339602019869,-311,78,5,"Ósá. Nánast engin skráning frá 2013","","522 1881","Setbergsá - Skógarströnd Allt  Stóra Langadalsá Skógarströnd Stóra Langadalsá Setbergsá Stóra-Langadalsá"
1910,"Prestbakkaá","Vestfirðir",3,291.64375561545376,109.57450408084887,4.514358348353819,91.31895226354445,291.64375561545376,152.66446258155057,4.950180084139153,141.20038958263504,40,"Prestbakkaá",-21.1954041449897,65.3142805504658,350,87,5,,"","1259 1745","Bakkaá Prestbakkaá Prestbakkaá Prestbakkaá"
2007,"Sandá","Norðurland eystra",5,938,490.9014525612597,6.0630347279803285,429.67741435816066,847,512.1171175501725,6.173166954282719,479.70290016689074,49,"Sandá",-15.5721037809815,66.2165074578297,850,596,10,,"","1219","Sandá Sandá Allt svæðið"
2052,"Saurasíki","Vesturland",2,1330,139.75533128778162,4.393293275542119,80.90642787989262,244.384646800481,102.86279509067583,4.460787182178044,86.55561732538852,24,"Grísholtsá og Bakká",-22.7733111898815,65.0173714760399,-321,89,5,"Saurasíki","","483 1499","Bakkaá og Gríshólsá Báðar árnar Bakkaá/Gríshólsá Gríshólsá og Bakkaá"
2063,"Selá","Vestfirðir",3,190,64.99202117142737,3.877017322738896,48.27999645188194,119.69614717917807,47.31648891999495,3.659782247835815,38.852881651077034,42,"Selá í Steingrímsfirði",-21.7200413667371,65.7763582664214,350,68,5,,"","1059","Selá Allt svæðið Selá Steingrímsfirði"
2080,"Selá","Austfirðir",6,4609,2044.1833117024773,7.477809350872422,1768.3626675607845,2243.5,1651.4482273421374,7.3738666162147215,1593.7844370191458,49,"Selá í Vopnafirði",-14.8028438459259,65.8259886507293,1000,3502,15,,"","562","Selá Allt svæðið Selá í Vopnafirði"
2090,"Selá","Austfirðir",6,298.5,132.15613747199356,4.419449330075554,83.05053932980076,80.5,30.16841241598073,3.1669683639185866,23.735418022490848,15,"Selá í Álftafirði",-14.50066,64.53473,,,,"Selá í Álftafirði","ny","984","Selá Álftafirði Selá Selá"
2097,"Selfljót","Austfirðir",6,241.5,81.79688946911894,4.127257705924803,62.007646366010725,86,38.648491035740044,3.4723752959915535,32.21316745033578,37,"Selfljót og Gilsá",-13.9911360972489,65.5977827863711,1050,117,5,,"","261","Selfljót og Gilsá Selfljót og Gilsá Austurland Selfljót og Gilsá"
2223,"Skjálfandafljót","Norðurland eystra",5,2340,952.2349367551614,6.487484911881879,656.8691999840107,1649,920.4776964247746,6.662715658199894,782.6735274901371,48,"Skjálfandafljót",-17.632359123295,65.9867698851378,788,1108,15,,"","539 1751","Djúpá Skjálfandafljót Skjálfandafljót B-deild Skjálfandafljót B-deild Djúpá"
2239,"Skógá","Suðurland",7,3061,503.4470852253414,5.263399708467821,193.136985866976,505.9163746024887,261.6269699617383,5.260238917108272,192.52748391253485,21,"Skógá",-19.56521,63.49429,,,,"Skógá","ny","1479","Skógá Skógá Skógá Rángárvallasýsla"
2282,"Staðará","Vestfirðir",3,417.8863432165319,165.67094296683615,4.935913977078162,139.20031030190154,417.8863432165319,214.58505475739543,5.244789468785378,189.57589938354116,43,"Staðará í Steingrímsfirði",-21.78297,65.76625,,,,"Staðará í Steingrímsfirði","ny","181","Staðará Allt Svæðið Staðará Steingrímsf"
2385,"Straumfjarðará","Vesturland",2,1790.5,777.115336002743,6.376612618781366,587.9327783218215,1423.4983494914272,1009.3766800137147,6.888385423034055,980.816534320714,50,"Straumfjarðará",-22.7011689472606,64.8088874883025,-454,860,10,,"","779 1925 1927 2339","Laxá í Miklaholtshreppi Laxá Löngufjörum Laxá Staðarsveit Straumfjarðará Laxá Miklaholtshreppi Allt svæðið Straumfjarðará Allt svæðið"
2424,"Svalbarðsá","Norðurland eystra",5,1148,440.7688042545258,5.936700795199097,378.68351187128013,1148,577.7671408471767,6.284293018979967,536.0851546028744,49,"Svalbarðsá",-15.6937917037814,66.2229660607333,850,679,10,,"","121 800","Svalbarðsá Allt Svæðið Svalbarðsá Svalbarðsá Þistilsfirði"
2599,"Úlfarsá (Korpa)","Reykjanes",1,1418,554.7345931508207,6.242395620525877,514.0885981412961,797.1559067898561,550.9495064390215,6.254606143896599,520.4043699515406,49,"Úlfarsá (Korpa)",-21.74713512,64.16508178,-553,425,10,,"","480","Úlfarsá Úlfarsá (Korpa) Allt svæðið Úlfarsá (Korpa) Vorveiði Úlfarsá"
2643,"Vatnsdalsá","Vestfirðir",3,201.73769643918922,108.54008101022013,4.498447004821658,89.87744362486215,201.73769643918922,95.70584158748878,4.3502177101594,77.49533261005867,11,"Vatnsdalsá í Vatnsfirði",-23.13391,65.58523,,,,"Vatnsdalsá í Vatnsfirði","ny","1359","Vatnsdalsá í Vatnsfirði Vatnsdalsá Vatnsdalsá"
2645,"Vatnsdalsá","Norðurland vestra",4,3164,1625.700858687463,7.292385815215801,1469.0714524902621,2702.5265049415993,1479.1042934373165,7.238488049377427,1391.9877622622164,50,"Vatnsdalsá",-20.3836423710055,65.5884267956652,450,1890,15,,"","81","Vatnsdalsá Vatnsdalsá Laxasvæði Vatnsdalsá Silungasvæði"
2646,"Vatnsholtsá","Vesturland",2,624,152.9215181491568,4.4629802692632765,86.7456496344351,77.50126871568045,31.779743296439857,3.3323736954654826,28.004737588881678,38,"Vatnsholtsós og vötn",-23.2723847868492,64.8268408908204,-430,97,5,,"","531","Vatnsholtsá Vatnsholtsá Vatnasvæði Lýsu"
2691,"Víðidalsá","Vestfirðir",3,567.1407251981467,210.88353048432253,4.971324280394137,144.21774570117327,567.1407251981467,386.39712871158406,5.93641180135231,378.57409047828605,38,"Víðidalsá í Steingrímsf.",-21.674848488264,65.6833869412989,340,214,5,,"","899 1771","Víðidalsá Steingrímsfirði Þverá-Húsadalsá-Víðidalsá Víðidalsá Upp að virkjun"
2791,"Þjórsá","Suðurland",7,20787.6997207711,2915.9326112466993,5.616794558525501,275.0064518118879,20787.6997207711,12470.846750610142,9.15406538320771,9452.791589948765,45,"Þjórsá",-20.74636,63.80059,,8062,15,,"","303 489 802 900 979 1179 1181 1943 2241","Fossá í Þjórsárdal Kálfá Gnúpverjahreppi Kvíslaveitur Minnivallalækur Sandá Þjórárdal Þjórsá Þórisvatn Þverá Gnúpverjahreppi Þverá Þjórsárdal Fossá Þjórsárdal Fossá Kálfá Öll áin Sandá Þjórsárdal Sandá Þjórsá Egilsstaðir 2 NET Þjórsá Ferjunes NET Þjórsá Kálfholt NET Þjórsá Miðhús I og II Þjórsá Minna - Hof NET Þjórsá Sandbakki NET Þjórsá Sandhólaferja NET Þjórsá Selpartur Þjórsá Skálmholt Þjórsá Skeiðháholt 1 NET Þjórsá Skeiðháholt 3 NET Þjórsá Stöðufell þjórsá Urriðafoss Þjórsá Þjósártún NET Þverá Þjórsárdal Þverá Þjórsárdal"
2799,"Þorskafjarðará","Vestfirðir",3,160.5001344447432,53.695458605799956,3.6358135161373806,37.9326992113966,160.5001344447432,71.3581923750799,4.088221335661796,59.63372893116051,26,"Þorskafjarðará",-22.09426,65.60481,,,,"Þorskafjarðará","ny","495","Þorskafjarðará Þorskafjarðará Þorskafjarðará"
